{"eta_p50":"2026-05-11T13:39:57.688477+00:00","eta_p90":"2026-05-11T14:25:55.109143+00:00","gauge_flags":[],"model":"Monte Carlo on ASSUMED simulation; not validated real-world probabilities","n_runs":2000,"p_excursion":0.0,"p_miss_slot":1.0,"per_action":{"BUFFER":{"eligible":true,"exp_delay_min":0.0,"p_excursion":0.0,"p_miss_slot":0.0,"reason":"Eligible simulation variant","stock_after":1},"EXPEDITE":{"eligible":true,"exp_delay_min":540.1455278233499,"p_excursion":0.0,"p_miss_slot":1.0,"reason":"Eligible simulation variant","stock_after":2},"QUARANTINE":{"eligible":true,"exp_delay_min":0.0,"p_excursion":0.0,"p_miss_slot":0.0,"reason":"Eligible simulation variant","stock_after":1},"REROUTE":{"eligible":true,"exp_delay_min":0.0,"p_excursion":0.0,"p_miss_slot":0.0,"reason":"Eligible simulation variant","stock_after":2},"RUN_AS_PLANNED":{"eligible":true,"exp_delay_min":580.5623735924584,"p_excursion":0.0,"p_miss_slot":1.0,"reason":"Eligible simulation variant","stock_after":2}},"river_forecast":[],"scenario_id":"s1_normal_2026-05-10","sources":{"eta":"Monte Carlo quantiles; conditional on route completion; null if suspended","gauge_flags":"not evaluated; optional priority 3","per_action":"decision_analysis: 2000 paired seeded simulated journeys per action","river_forecast":"not trained; TODO(verify): long history and persistence comparison"}}
