{"eta_p50":null,"eta_p90":null,"gauge_flags":[],"model":"Monte Carlo on ASSUMED simulation; not validated real-world probabilities","n_runs":2000,"p_excursion":0.0,"p_miss_slot":1.0,"per_action":{"BUFFER":{"eligible":true,"exp_delay_min":0.0,"p_excursion":0.0,"p_miss_slot":0.0,"reason":"Eligible simulation variant","stock_after":1},"EXPEDITE":{"eligible":false,"exp_delay_min":10080.0,"p_excursion":0.0,"p_miss_slot":1.0,"reason":"The route is suspended; a faster slot on the same route cannot resolve it","stock_after":2},"QUARANTINE":{"eligible":true,"exp_delay_min":0.0,"p_excursion":0.0,"p_miss_slot":0.0,"reason":"Eligible simulation variant","stock_after":1},"REROUTE":{"eligible":true,"exp_delay_min":645.0885540113833,"p_excursion":0.0235,"p_miss_slot":1.0,"reason":"Eligible simulation variant","stock_after":2},"RUN_AS_PLANNED":{"eligible":true,"exp_delay_min":10080.0,"p_excursion":0.0,"p_miss_slot":1.0,"reason":"Eligible simulation variant","stock_after":2}},"river_forecast":[],"scenario_id":"s3_lowriver_2026-10-01","sources":{"eta":"Monte Carlo quantiles; conditional on route completion; null if suspended","gauge_flags":"not evaluated; optional priority 3","per_action":"decision_analysis: 2000 paired seeded simulated journeys per action","river_forecast":"not trained; TODO(verify): long history and persistence comparison"}}
